"EventType","ID","Classification","Title","Workload","Status","StartTime","LastUpdatedTime","EndTime","ActionType","AffectedTenantCount","Message","MessageType","WorkloadDisplayName","Feature","FeatureDisplayName","PostIncidentDocumentUrl","Severity","ImpactDescription"
"New","EX174013","Advisory","Unable to execute some provisioning workflows","Exchange","Service restored","2/17/2019 10:10:00 AM","2/23/2019 8:41:23 AM","2/23/2019 7:50:00 AM","","16133687","Title: Unable to execute some provisioning workflows

User Impact: Affected admins were unable to execute some provisioning workflows.

More info: Affected admins were receiving an error within the provisioning page of the admin portal when attempting to assign licenses to users, or move users in or out of a group with the affected SKUs. Impact was predominately to groups and users with E3 licenses, though other license types may have also have been affected.

Final status: We've deployed a fix that removes the dependency on MyAnalytics and we've confirmed that impact has been remediated.

Scope of impact: This issue may have potentially affected any admins attempting to assign licenses or manage groups with the affected SKUs.

Start time: Sunday, February 17, 2019, at 2:10 AM UTC

End time: Friday, February 22, 2019, at 11:50 PM UTC

Preliminary root cause: A routine service update to enable new features was implemented with no expected impact to service availability. During this process, a configuration issue was introduced that caused admins to receive errors when attempting to assign licenses to users or move users in or out of groups within an affected SKU.

Next steps:
We're reviewing our update procedures to ensure that service dependency issues are identified during our development and testing cycles.

This is the final update for the event.","Incident","Exchange Online","Provisioning","Management and Provisioning","","Sev2","Affected admins were unable to execute some provisioning workflows."
"New","MO173811","Advisory","Error when loading Office apps","OSDPPlatform","Service degradation","2/12/2019 8:00:00 AM","2/23/2019 8:10:13 AM","","","21254332","Title: Error when loading Office apps

User Impact: Users may experience errors and app closures when loading any Office 2013, Office 2016, or Office 365 desktop apps.

More info: Specifically, users may see an error message that states: ""We're sorry, but Office App has run into an error that is preventing it from working correctly. Office App will need to be closed as a result. Would you like us to repair now?""

As a potential workaround, users can run Windows update. If impact persists following updates, users should restart their Operating System (OS).

Current status: We've rolled out a fix to a majority of the affected environment. If users continue to experience impact, they can run Windows update to ensure that Windows Defender Antivirus has installed Security intelligence version 1.1.287.94.0 or higher to resolve the issue themselves.

Scope of impact: This issue could potentially affect any of your users that are attempting to open Office 2013, Office 2016, or Office 365 desktop apps.

Start time: Tuesday, February 12, 2019, at 12:00 AM UTC

Preliminary root cause: An issue within the February 14, 2019 Windows Defender update resulted in errors and app closures when loading any Office 2013, Office 2016, or Office 365 desktop apps.

Next update by: Tuesday, February 26, 2019, at 1:00 AM UTC","Incident","Office 365 Portal","Administration","Administration","","Sev2","Users may experience errors and app closures when loading any Office 2013, Office 2016, or Office 365 desktop apps."
"New","EX173804","Advisory","Can't access eDiscovery features and content search","Exchange","Service degradation","2/20/2019 6:17:11 AM","2/23/2019 6:31:09 AM","","","14600730","Title: Can't access eDiscovery features and content search

User Impact: Admins may be unable to access eDiscovery features such as content search using the Security and Compliance Center.

More info: This is an incremental update to provide the latest status on the issue.

Current status: Our testing indicates that users should no longer be experiencing impact related to this event. We'll continue to monitor the service through the weekend to confirm that the issue is resolved. 

Next update by: Monday, February 25, 2019, at 8:00 PM UTC","Incident","Exchange Online","Provisioning","Management and Provisioning","","Sev2","Admins may be unable to access eDiscovery features such as content search using the Security and Compliance Center."
"New","TM173240","Advisory","Can?t properly join recurring Teams meetings from the PSTN","microsoftteams","Service restored","11/15/2018 8:00:00 AM","2/21/2019 8:26:03 AM","2/9/2019 3:00:00 AM","","4465334","Title: Can?t properly join recurring Teams meetings from the PSTN

User Impact: PSTN users may be unable to dial in to recurring Teams meetings created before December 5, 2018.

More info: Any recurring Teams meetings created before December 5, 2018, with an end date after January 30, 2019, may have been subject to this problem. All Teams meetings created outside of these parameters were unaffected by the issue.

Final status: We've determined that we won?t be able to restore Public Switched Telephone Network (PSTN) calling functionality to the affected scheduled Teams Meetings. Users will need to reschedule any recurring meetings that require a PSTN bridge. 

Scope of impact: This issue may have potentially affected any of your PSTN users attempting to dial in to the affected subset of recurring Teams meetings.

Start time: Thursday, November 15, 2018, at 12:00 AM UTC

End time: Friday, February 8, 2019, at 7:00 PM UTC

Preliminary root cause: A previously resolved code issue has impacted a subset of recurring Teams meetings, preventing PSTN users from correctly dialing into them.

Next steps:
- We're reviewing our update procedures to identify potential PSTN issues during our development and testing cycles.

This is the final update for the event.","Incident","Microsoft Teams","TeamsComponents","Teams Components","","Sev2","PSTN users may be unable to dial in to recurring Teams meetings created before December 5, 2018"
"New","SP173598","Advisory","People Picker functionality degraded","SharePoint","Service restored","2/15/2019 6:30:00 AM","2/20/2019 10:10:10 AM","2/20/2019 2:00:00 AM","","11902252","Title: People Picker functionality degraded

User Impact: Affected users may have been unable to use some People Picker functionality.

More info: Most core People Picker functionality was unaffected; however, affected users may have been unable to leverage specific features like the people resolver functionality when searching for other users.

Final status: We've confirmed that the deployment is complete and the issue has been remediated.

Scope of impact: This issue may have potentially affected any of your users attempting to use People Picker functionality.

Start time: Thursday, February 14, 2019, at 10:30 PM UTC

End time: Tuesday, February 19, 2019, at 6:00 PM UTC

Preliminary root cause: A coding issue prevented some People Picker features from working as expected.

Next steps:
- We're analyzing performance data and trends on the affected systems to help prevent this problem from happening again.

This is the final update for the event.","Incident","SharePoint Online","spofeatures","SharePoint Features","","Sev2","Affected users may have been unable to use some People Picker functionality."
"New","SP173725","Advisory","Can't perform modern site searches","SharePoint","Restoring service","2/1/2019 8:00:00 AM","2/18/2019 4:56:16 AM","","","11871382","Title: Can't perform modern site searches

User Impact: Users may be unable to perform site searches from modern sites.

More info: Users may receive a ""Something went wrong! Please try searching again or refresh the page"" error. While we're focused on remediation, users can click on the Organization search breadcrumb at the top of the search box to perform a tenant-wide search rather than a site search. Until the fix is deployed, we recommend users add path:""[URL-OF-THE-TEAMSITE]"" to the search box, in addition to your search term, as a workaround to complete a site search.

Current status: We've identified an update to search code has impacted modern site search functionality. We've developed a code fix and are in the process of deploying it throughout all affected environments to resolve the impact.

Scope of impact: This issue could potentially affect any users performing a modern site search.

Start time: Friday, February 1, 2019, at 12:00 AM UTC

Estimated time to resolve: We estimate the fix will be completely deployed by the end of Tuesday, February 26, 2019.

Preliminary root cause: An update to search code, which was expected to prevent a user relevancy search issue for modern sites from impacting site searches, isn't working as intended.

Next update by: Tuesday, February 26, 2019, at 9:00 PM UTC","Incident","SharePoint Online","search","Search and Delve","","Sev2","Users may be unable to perform site searches from modern sites."
"New","TM173669","Advisory","Can't schedule Teams Live Events with Yammer integration","microsoftteams","Service restored","2/16/2019 12:46:00 PM","2/16/2019 1:42:36 PM","2/16/2019 12:54:01 PM","","4411887","Title: Can't schedule Teams Live Events with Yammer integration

User impact: Users may have been unable to schedule Teams Live Events, or Teams Broadcast, with Yammer integration.


More info: Additionally, users may have been unable to update existing Live Events with Yammer integration. 

Final status: We've determined that a recent update inadvertently introduced a code issue that resulted in problems scheduling or updating Teams Live events with Yammer integration. We've reverted the affected update and have confirmed that service health is restored.

Scope of impact: Any user scheduling or updating Teams Live events with Yammer integration may have experienced impact. 

Start time: Friday, February 15, 2019, at 10:53 PM UTC

End time: Friday, February 16, 2018, at 12:00 AM UTC

Preliminary root cause: A recent update inadvertently introduced a code issue that resulted in users being unable to schedule or update Teams Live events with Yammer integration.

Next steps:
We're reviewing our validation and update procedures to recognize and prevent code issues like this from happening in the future. 

This is the final update for the event.","Incident","Microsoft Teams","TeamsComponents","Teams Components","","Sev2","Users may have been unable to schedule Teams Live Events, or Teams Broadcast, with Microsoft Teams integration."
"New","TM173383","Advisory","Can't add new members ","microsoftteams","Service restored","2/12/2019 9:00:00 AM","2/15/2019 10:14:33 AM","2/12/2019 11:28:00 AM","","4422434","Title: Can't add new members 

User Impact: Users may have been unable to add members to Microsoft Teams.

Final status: We investigated the issue and determined that a recent update intended to improve Microsoft Teams functionality, inadvertently caused 400 errors and other issues with Team creation and Team membership management. We've reverted the change and confirmed that the issue has been resolved.

Scope of impact: This issue could have potentially affected any of your users intermittently if they were routed through the affected infrastructure.

Start time: Tuesday, February 12, 2019, at 1:00 AM UTC

End time: Tuesday, February 12, 2019, at 3:28 AM UTC

Preliminary root cause: A recent update intended to improve Microsoft Teams functionality unexpectedly caused impact.

Next steps:
- We're reviewing our update procedures to better identify similar issues during our development and testing cycles.

This is the final update for the event.","Incident","Microsoft Teams","TeamsComponents","Teams Components","","Sev2","Users may have been unable to add members to Microsoft Teams."
"New","EX171088","Advisory","Unable to manage rules in the Outlook client","Exchange","Service restored","12/20/2018 4:44:17 AM","2/15/2019 3:28:36 AM","2/14/2019 2:00:00 AM","","14610348","Title: Unable to manage rules in the Outlook client

User Impact: Users are receiving an error when attempting to manage their rules in the Outlook client.

More info: This is an incremental update to provide the latest status on the issue.

Current status: We've prepared our fix for deployment and will monitor it's progress as it's safely implemented through our change management system. The problem will be fixed for affected customers as the fix reaches their respective environments. For complete details on this event, please reference the post from 5:18 PM UTC on December 27, 2018.

Next update by: Thursday, January 24, 2019, at 7:30 PM UTC","Incident","Exchange Online","Provisioning","Management and Provisioning","","Sev2","Users are receiving an error when attempting to manage their rules in the Outlook client."
"New","MO172571","Advisory","Incomplete Teams user reports","OSDPPlatform","Service restored","1/17/2019 4:00:00 PM","2/13/2019 9:29:18 PM","2/13/2019 8:13:00 PM","","21101811","Title: Incomplete Teams user reports

User Impact: Teams user reports were not showing results since January 17th, 2019.

More info: Teams channel data from December 1st, 2018 to February 6th, 2019 was delayed.

Final status: We've successfully migrated the data to the correct infrastructure and confirmed that the issue is resolved.

Scope of impact: Impact was specific to admins who were served through the affected infrastructure and were viewing Teams user reports.

Start time: Thursday, January 17, 2019, at 8:00 AM UTC

End time: Wednesday, February 13, 2019, at 12:13 PM UTC

Preliminary root cause: A configuration issue caused the infrastructure responsible for storing and processing usage data to become unhealthy.

Next steps:
- We?re reviewing our code for improved performance and potential automated recovery options to reduce or avoid similar impact in the future.

This is the final update for the event.","Incident","Office 365 Portal","Administration","Administration","","Sev2","Teams user reports were not showing results since January 17th, 2019."
"New","SP173204","Advisory","Couldn't edit SharePoint Online 2010 Workflows","SharePoint","Service restored","2/6/2019 3:51:00 PM","2/12/2019 3:46:55 AM","2/11/2019 12:35:00 AM","","11665595","Title: Couldn't edit SharePoint Online 2010 Workflows

User Impact: Users may have been unable to edit SharePoint Online 2010 workflows.

More info: Impact was specific to 2010 workflows previously created in SharePoint Designer.

Final status: The deployment of the fix has completed and our telemetry indicates impact remediation. Additionally, we've worked directly with some affected customers to confirm resolution. 

Scope of impact: This issue will impacted any of your users attempting to edit 2010 SharePoint Online workflows within SharePoint Designer.

Start time: Wednesday, February 6, 2019, at 7:51 AM UTC

End time: Sunday, February 10, 2019, at 4:35 PM UTC

Preliminary root cause: A code regression introduced after a recent SharePoint Online update prevented users from editing 2010 SharePoint Online workflows within SharePoint Designer.

Next steps:
- We're reviewing our monitoring services to look for ways to reduce detection time and more quickly restore service.
- We're reviewing our update procedures to better identify similar issues during our development and testing cycles.

This is the final update for the event.","Incident","SharePoint Online","spofeatures","SharePoint Features","","Sev2","Users may have been unable to edit SharePoint Online 2010 workflows."
"New","LY173214","Incident","Can't sign in","Lync","Service restored","2/7/2019 3:43:00 PM","2/9/2019 12:38:02 AM","2/8/2019 11:30:00 PM","","496919","Title: Can't sign in

User Impact: Newly created users may have been unable to sign in to the Skype for Business service.

Final status: We've restarted the subset of RIDS infrastructure and confirm via our monitoring system that the problem is fixed.

Scope of impact: Impact was specific to a subset of users who were created after February 5th, 2019.

Start time: Thursday, February 7, 2019, at 7:43 AM UTC

End time: Friday, February 8, 2019, at 3:30 PM UTC

Preliminary root cause: A subset of Routing Information Directory Service (RIDS) infrastructure, which handles outstanding provider requests, was performing below acceptable thresholds, resulting in impact.

Next steps:
- We're reviewing configurations within the subset of infrastructure that caused this to reduce or avoid similar impact in the future.

This is the final update for the event.","Incident","Skype for Business","Sign-In","Sign-In","","Sev2","Newly created users may have been unable to sign in to the Skype for Business service."
"New","LY172944","Incident","Can't make or received calls","Lync","Service restored","2/5/2019 9:30:00 AM","2/8/2019 11:20:01 AM","2/5/2019 2:10:00 PM","","1004945","Title: Can't make or received calls

User Impact: Users may have experienced intermittent outages making and receiving calls via Skype for Business.

Final status: We've completed restarting the affected infrastructure and confirmed mitigation with some of the affected users and via monitoring. 

Scope of impact: This issue could have potentially affected any of your users intermittently if they were routed through the affected infrastructure.

Start time: Tuesday, February 5, 2019, at 1:30 AM UTC

End time: Tuesday, February 5, 2019, at 6:10 AM UTC

Preliminary root cause: An update to the infrastructure facilitating the Skype for Business network had become degraded.

Next steps:
- We?re reviewing our code for improved performance and potential automated recovery options to reduce or avoid similar impact in the future.

This is the final update for the event.","Incident","Skype for Business","AudioVideo","Audio and Video","","Sev2","Users may have experienced intermittent outages making and receiving calls via Skype for Business."
"New","MO171766","Advisory","Incomplete usage reports","OSDPPlatform","Service restored","1/7/2019 4:00:00 AM","2/8/2019 10:03:45 AM","2/4/2019 8:00:00 AM","","21433476","Title: Incomplete usage reports

User Impact: Usage reports are not showing results past January 4th, 2019.

Current status: As part of our two-part recovery process, we've imported action log data from Microsoft Teams. We?re currently rebuilding our reports based on the action log data from Microsoft Teams to remediate the problem.

Scope of impact: Impact is specific to admins who are served through the affected infrastructure and are viewing service usage reports.

Start time: Sunday, January 6, 2019, at 8:00 PM UTC

Preliminary root cause: A configuration issue caused the infrastructure responsible for storing and processing usage data to become unhealthy.

Next update by: Sunday, February 3, 2019, at 1:30 AM UTC","Incident","Office 365 Portal","Administration","Administration","","Sev2","Usage reports were not showing results past February 2nd, 2019."
"New","TM173200","Advisory","Can't access Microsoft Teams in Google Chrome","microsoftteams","Service restored","2/8/2019 3:43:00 AM","2/8/2019 9:06:01 AM","2/8/2019 5:50:00 AM","","4355807","Title: Can't access Microsoft Teams in Google Chrome

User Impact: Users may be unable to access Microsoft Teams in Google Chrome. 

More Info: This issue also affects users' ability to sign into Microsoft Teams on Mac or iOS devices.

Current status: We're reviewing the certificate associated with the Microsoft Teams sign-in process to determine potential sources of impact. 

Scope of impact: This issue may affect all users attempting to access Microsoft Teams in Google Chrome.

Next update by: Thursday, February 7, 2019, at 11:30 PM UTC","Incident","Microsoft Teams","TeamsComponents","Teams Components","","Sev2","Users may have been unable to access Microsoft Teams in Google Chrome. "
"New","LY173198","Advisory","Can't view users in Skype for Business admin center","Lync","Service restored","2/5/2019 4:07:00 AM","2/8/2019 6:12:45 AM","2/8/2019 5:20:00 AM","","8507806","Title: Can't view users in Skype for Business admin center

User Impact: Admins were unable to view users via the Voice tab within the Skype for Business admin center.

More info: Admins were receiving the following error: ""Your request can't be completed right now. Please try again later.""

Final status: We've received confirmation that increasing thresholds has successfully mitigated impact. 

Scope of impact: Some organizations may have been affected by this event. Impact was specific to admins attempting to view users via the Voice tab within the Skype for Business admin center. 

Start time: Monday, February 4, 2019, at 8:07 PM UTC

End time: Thursday, February 7, 2019, at 9:20 PM UTC

Preliminary root cause: Requests made from the Skype for Business admin center were throttled, resulting in impact. 

Next steps:
- We're reviewing our request throttling procedures to find ways to prevent this problem from reoccurring. 

This is the final update for the event.","Incident","Skype for Business","ManagementandProvisioning","Management and Provisioning","","Sev1","Admins were unable to view users via the Voice tab within the Skype for Business admin center."
"New","TM173175","Advisory","Can't see pictures and emojis","microsoftteams","Service restored","2/7/2019 3:30:00 PM","2/8/2019 1:34:59 AM","2/7/2019 11:00:00 PM","","4355806","Title: Can't see pictures and emojis

User Impact: Users may have been unable to see pictures and emojis within the Microsoft Teams service.

Final status: We completed reverting the offending update and cleared the cache of affected URLs to ensure remediation. We've confirmed the issue is now resolved. 

Scope of impact: Impact was specific to some users based in the Western United States.

Start time: Thursday, February 7, 2019, at 7:30 AM UTC

End time: Thursday, February 7, 2019, at 3:00 PM UTC

Preliminary root cause: A recent service update unexpectedly contained a regression, resulting in impact. 

Next steps:
- We're analyzing the update to understand why the regression wasn't detected during our testing phases and how to prevent similar issues in the future. 

This is the final update for the event.","Incident","Microsoft Teams","TeamsComponents","Teams Components","","Sev2","Users may have been unable to see pictures and emojis within the Microsoft Teams service."
"New","EX173182","Incident","Can't access Outlook on the web","Exchange","Service restored","2/7/2019 7:00:00 PM","2/7/2019 11:52:55 PM","2/7/2019 10:15:00 PM","","953103","Title: Can't access Outlook on the web

User Impact: Users may have been intermittently unable to access Outlook on the web.

More info: While we were focused on remediation, users may have been able to access their mailbox using the Outlook desktop client or mobile app.

Final status: We suspect that a recent update may have caused impact. Before we could take any corrective action, automated recovery systems resolved the issue and service availability recovered to acceptable thresholds.

Scope of impact: Impact was specific to a subset of users who were served through the affected infrastructure.

Start time: Thursday, February 7, 2019, at 11:00 AM UTC

End time: Thursday, February 7, 2019, at 2:15 PM UTC

Preliminary root cause: We suspect that a recent update may have caused impact. We'll continue to investigate diagnostic data to verify the root cause of the issue.

Next steps:
- We're reviewing our update procedures to better identify similar issues during our development and testing cycles.

This is the final update for the event.","Incident","Exchange Online","Access","E-Mail and calendar access","","Sev2","Users may have been intermittently unable to access Outlook on the web."
"New","EX173164","Advisory","Emails in pending state","Exchange","Service restored","2/7/2019 11:45:17 AM","2/7/2019 4:08:57 PM","2/7/2019 2:03:00 PM","","14679481","Title: Emails in pending state

User Impact: Users may notice that sent emails are stuck in a pending state.. 

Current status: We're investigating a potential issue and checking for impact to your organization. We'll provide an update within 30 minutes.","Incident","Exchange Online","Delivery","E-Mail timely delivery","","Sev2","Users may have experienced mail delivery delays, related to an issue with a third-party mail signature service."
"New","TM172961","Advisory","Delays receiving notifications","microsoftteams","Service restored","2/6/2019 1:00:00 AM","2/6/2019 6:56:16 AM","2/6/2019 6:41:00 AM","","4341679","Title: Delays receiving notifications

User Impact: Users may have received delayed message and change notifications within the Shifts tab of Microsoft Teams.

Final status: We've monitored the service and confirmed that the restarts successfully resolved the issue, and that the backlog of requests have been processed. 

Scope of impact: Impact was specific to a subset of users who were served through the affected infrastructure.

Start time: Tuesday, February 5, 2019, at 5:00 PM UTC

End time: Tuesday, February 5, 2019, at 10:41 PM UTC

Preliminary root cause: A portion of infrastructure wasn't processing traffic as efficiently as expected, creating a backlog of requests that resulted in impact.

Next steps:
- We're continuing to analyze the affected infrastructure to identify what caused traffic to stop processing as expected and to prevent similar issues in the future. 

This is the final update for the event.","Incident","Microsoft Teams","TeamsComponents","Teams Components","","Sev2","Users may have received delayed message and change notifications within the Shifts tab of Microsoft Teams."
